{
  "schema_version": 1,
  "model": {
    "id": "qwen3-aligner-0.6b",
    "version": "1.1.0",
    "display_name": "Qwen3 ForcedAligner 0.6B",
    "task": "forced-alignment",
    "description": "Word- or character-level alignment for known transcripts with a native CPU Rust runtime"
  },
  "license": {
    "spdx": "Apache-2.0",
    "redistribution": "allowed",
    "files": [
      {
        "path": "card/LICENSE",
        "bytes": 11357,
        "sha256": "c71d239df91726fc519c6eb72d318ec65820627232b2f796219e87dcf35d0ab4"
      }
    ],
    "notes": [
      "The pinned upstream Hugging Face model card declares Apache-2.0."
    ]
  },
  "provenance": {
    "repository": "https://huggingface.co/Qwen/Qwen3-ForcedAligner-0.6B",
    "revision": "c7cbfc2048c462b0d63a45797104fc9db3ad62b7",
    "weights": [
      {
        "id": "qwen3-forced-aligner-0.6b-bf16",
        "source": "https://huggingface.co/Qwen/Qwen3-ForcedAligner-0.6B/resolve/c7cbfc2048c462b0d63a45797104fc9db3ad62b7/model.safetensors",
        "bytes": 1835544544,
        "sha256": "47831d0e82f96b20e9034dba01a075ee06436654719f6a68289e49f1b65ce0e7"
      }
    ],
    "notes": [
      "Model and tokenizer files are downloaded directly from the pinned official Hugging Face repository.",
      "Valle supplies the Apache-2.0 license text locally and verifies every installed file against this manifest."
    ]
  },
  "release": {
    "state": "ready",
    "repository": "Qwen/Qwen3-ForcedAligner-0.6B"
  },
  "contract": {
    "adapter": "qwen3-forced-alignment",
    "version": 1,
    "inputs": [
      {
        "name": "audio",
        "dtype": "f32",
        "layout": "mono-samples",
        "shape": [
          "samples"
        ],
        "range": [
          -1,
          1
        ],
        "description": "Finite mono PCM at exactly 16 kHz"
      },
      {
        "name": "text",
        "dtype": "utf8",
        "layout": "scalar",
        "shape": [
          1
        ],
        "range": null,
        "description": "Known non-empty transcript"
      },
      {
        "name": "language",
        "dtype": "utf8",
        "layout": "scalar",
        "shape": [
          1
        ],
        "range": null,
        "description": "Required supported English language name or ISO-639 code"
      }
    ],
    "outputs": [
      {
        "name": "units",
        "dtype": "record",
        "layout": "text-start_ms-end_ms",
        "shape": [
          "units"
        ],
        "range": null,
        "description": "Ordered word timestamps, or character timestamps for CJK languages"
      }
    ],
    "preprocess": {
      "sample_rate": 16000,
      "channels": 1,
      "sample_format": "f32",
      "sample_range": [
        -1,
        1
      ],
      "file_decode_owner": "consumer",
      "resample_owner": "consumer",
      "maximum_audio_seconds": 30
    },
    "postprocess": {
      "time_unit": "milliseconds",
      "timestamps_monotonic": true,
      "cjk_granularity": "character",
      "other_granularity": "whitespace-word"
    }
  },
  "artifacts": [
    {
      "id": "safetensors-bf16",
      "format": "safetensors-directory",
      "precision": "bf16",
      "entrypoint": "model.safetensors",
      "files": [
        {
          "path": "config.json",
          "bytes": 5982,
          "sha256": "d616c65d46c4b90bdc651b0a0963ea932732241140f337f9bb6b0335a9c8ef09"
        },
        {
          "path": "merges.txt",
          "bytes": 1671853,
          "sha256": "8831e4f1a044471340f7c0a83d7bd71306a5b867e95fd870f74d0c5308a904d5"
        },
        {
          "path": "model.safetensors",
          "bytes": 1835544544,
          "sha256": "47831d0e82f96b20e9034dba01a075ee06436654719f6a68289e49f1b65ce0e7"
        },
        {
          "path": "vocab.json",
          "bytes": 2776833,
          "sha256": "ca10d7e9fb3ed18575dd1e277a2579c16d108e32f27439684afa0e10b1440910"
        },
        {
          "path": "tokenizer_config.json",
          "bytes": 12666,
          "sha256": "3ab80063f8511deb9566e6ad438d17b7a6277fcffd52d92854112f19d36bd81c"
        }
      ],
      "metadata": {
        "runtime": "valle-asr 0.1.0",
        "loader_root": ".",
        "sample_rate": 16000,
        "maximum_audio_seconds": 30,
        "supported_languages": 9
      }
    }
  ],
  "routes": [
    {
      "id": "native-cpu-macos-arm64",
      "artifact": "safetensors-bf16",
      "backend": "native-cpu",
      "platforms": [
        "macos"
      ],
      "architectures": [
        "aarch64"
      ],
      "status": "verified",
      "priority": 100,
      "requirements": {
        "minimum_os": null,
        "minimum_runtime": "valle-asr 0.1.0"
      },
      "notes": "The published valle-asr CPU backend validates transcription and word alignment on macOS ARM64, Linux x64 and Windows x64."
    },
    {
      "id": "native-cpu-macos-x86_64",
      "artifact": "safetensors-bf16",
      "backend": "native-cpu",
      "platforms": [
        "macos"
      ],
      "architectures": [
        "x86_64"
      ],
      "status": "unverified",
      "priority": 100,
      "requirements": {
        "minimum_os": null,
        "minimum_runtime": "valle-asr 0.1.0"
      },
      "notes": "CPU backend can compile for this architecture; real inference is not included in the valle-asr validation matrix."
    },
    {
      "id": "native-cpu-linux-x86_64",
      "artifact": "safetensors-bf16",
      "backend": "native-cpu",
      "platforms": [
        "linux"
      ],
      "architectures": [
        "x86_64"
      ],
      "status": "verified",
      "priority": 100,
      "requirements": {
        "minimum_os": null,
        "minimum_runtime": "valle-asr 0.1.0"
      },
      "notes": "The published valle-asr CPU backend validates transcription and word alignment on macOS ARM64, Linux x64 and Windows x64."
    },
    {
      "id": "native-cpu-linux-arm64",
      "artifact": "safetensors-bf16",
      "backend": "native-cpu",
      "platforms": [
        "linux"
      ],
      "architectures": [
        "aarch64"
      ],
      "status": "unverified",
      "priority": 100,
      "requirements": {
        "minimum_os": null,
        "minimum_runtime": "valle-asr 0.1.0"
      },
      "notes": "CPU backend can compile for this architecture; real inference is not included in the valle-asr validation matrix."
    },
    {
      "id": "native-cpu-windows-x86_64",
      "artifact": "safetensors-bf16",
      "backend": "native-cpu",
      "platforms": [
        "windows"
      ],
      "architectures": [
        "x86_64"
      ],
      "status": "verified",
      "priority": 100,
      "requirements": {
        "minimum_os": null,
        "minimum_runtime": "valle-asr 0.1.0"
      },
      "notes": "The published valle-asr CPU backend validates transcription and word alignment on macOS ARM64, Linux x64 and Windows x64."
    },
    {
      "id": "native-cpu-windows-arm64",
      "artifact": "safetensors-bf16",
      "backend": "native-cpu",
      "platforms": [
        "windows"
      ],
      "architectures": [
        "aarch64"
      ],
      "status": "unverified",
      "priority": 100,
      "requirements": {
        "minimum_os": null,
        "minimum_runtime": "valle-asr 0.1.0"
      },
      "notes": "CPU backend can compile for this architecture; real inference is not included in the valle-asr validation matrix."
    }
  ]
}
