{
  "schema_version": 1,
  "model": {
    "id": "qwen3-asr-0.6b",
    "version": "1.1.0",
    "display_name": "Qwen3-ASR 0.6B",
    "task": "speech-transcription",
    "description": "Multilingual offline speech transcription with a native CPU Rust runtime"
  },
  "license": {
    "spdx": "Apache-2.0",
    "redistribution": "allowed",
    "files": [
      {
        "path": "card/LICENSE",
        "bytes": 11357,
        "sha256": "c71d239df91726fc519c6eb72d318ec65820627232b2f796219e87dcf35d0ab4"
      }
    ],
    "notes": [
      "The pinned upstream Hugging Face model card declares Apache-2.0."
    ]
  },
  "provenance": {
    "repository": "https://huggingface.co/Qwen/Qwen3-ASR-0.6B",
    "revision": "5eb144179a02acc5e5ba31e748d22b0cf3e303b0",
    "weights": [
      {
        "id": "qwen3-asr-0.6b-bf16",
        "source": "https://huggingface.co/Qwen/Qwen3-ASR-0.6B/resolve/5eb144179a02acc5e5ba31e748d22b0cf3e303b0/model.safetensors",
        "bytes": 1876091704,
        "sha256": "79d6cbd4c98c7bbffe9db2edac07f56cd6637d0d5944b27f6c2b8353840323ea"
      }
    ],
    "notes": [
      "Model and tokenizer files are downloaded directly from the pinned official Hugging Face repository.",
      "Valle supplies the Apache-2.0 license text locally and verifies every installed file against this manifest."
    ]
  },
  "release": {
    "state": "ready",
    "repository": "Qwen/Qwen3-ASR-0.6B"
  },
  "contract": {
    "adapter": "qwen3-asr-transcription",
    "version": 1,
    "inputs": [
      {
        "name": "audio",
        "dtype": "f32",
        "layout": "mono-samples",
        "shape": [
          "samples"
        ],
        "range": [
          -1,
          1
        ],
        "description": "Finite mono PCM at exactly 16 kHz"
      },
      {
        "name": "language",
        "dtype": "utf8",
        "layout": "scalar",
        "shape": [
          1
        ],
        "range": null,
        "description": "Optional English language name or ISO-639 code; null enables detection"
      }
    ],
    "outputs": [
      {
        "name": "text",
        "dtype": "utf8",
        "layout": "scalar",
        "shape": [
          1
        ],
        "range": null,
        "description": "Complete transcription"
      },
      {
        "name": "segments",
        "dtype": "record",
        "layout": "text-start_ms-end_ms",
        "shape": [
          "segments"
        ],
        "range": null,
        "description": "Ordered transcript segments with millisecond source spans"
      }
    ],
    "preprocess": {
      "sample_rate": 16000,
      "channels": 1,
      "sample_format": "f32",
      "sample_range": [
        -1,
        1
      ],
      "file_decode_owner": "consumer",
      "resample_owner": "consumer"
    },
    "postprocess": {
      "language": "iso-639",
      "time_unit": "milliseconds",
      "segments_ordered": true
    }
  },
  "artifacts": [
    {
      "id": "safetensors-bf16",
      "format": "safetensors-directory",
      "precision": "bf16",
      "entrypoint": "model.safetensors",
      "files": [
        {
          "path": "config.json",
          "bytes": 6193,
          "sha256": "76d3ae4601ce939830b2517f4a6cadb86cc51316c3900af6b020b051c21a478c"
        },
        {
          "path": "merges.txt",
          "bytes": 1671853,
          "sha256": "8831e4f1a044471340f7c0a83d7bd71306a5b867e95fd870f74d0c5308a904d5"
        },
        {
          "path": "model.safetensors",
          "bytes": 1876091704,
          "sha256": "79d6cbd4c98c7bbffe9db2edac07f56cd6637d0d5944b27f6c2b8353840323ea"
        },
        {
          "path": "vocab.json",
          "bytes": 2776833,
          "sha256": "ca10d7e9fb3ed18575dd1e277a2579c16d108e32f27439684afa0e10b1440910"
        },
        {
          "path": "tokenizer_config.json",
          "bytes": 12487,
          "sha256": "4942d005604266809309cabc9f4e9cb89ce855d59b14681fdc0e1cc62ea26c4c"
        }
      ],
      "metadata": {
        "runtime": "valle-asr 0.1.0",
        "loader_root": ".",
        "sample_rate": 16000,
        "supported_languages": 30,
        "supported_chinese_dialects": 22
      }
    }
  ],
  "routes": [
    {
      "id": "native-cpu-macos-arm64",
      "artifact": "safetensors-bf16",
      "backend": "native-cpu",
      "platforms": [
        "macos"
      ],
      "architectures": [
        "aarch64"
      ],
      "status": "verified",
      "priority": 100,
      "requirements": {
        "minimum_os": null,
        "minimum_runtime": "valle-asr 0.1.0"
      },
      "notes": "The published valle-asr CPU backend validates transcription and word alignment on macOS ARM64, Linux x64 and Windows x64.",
      "options": {
        "segment_seconds": 30
      }
    },
    {
      "id": "native-cpu-macos-x86_64",
      "artifact": "safetensors-bf16",
      "backend": "native-cpu",
      "platforms": [
        "macos"
      ],
      "architectures": [
        "x86_64"
      ],
      "status": "unverified",
      "priority": 100,
      "requirements": {
        "minimum_os": null,
        "minimum_runtime": "valle-asr 0.1.0"
      },
      "notes": "CPU backend can compile for this architecture; real inference is not included in the valle-asr validation matrix.",
      "options": {
        "segment_seconds": 30
      }
    },
    {
      "id": "native-cpu-linux-x86_64",
      "artifact": "safetensors-bf16",
      "backend": "native-cpu",
      "platforms": [
        "linux"
      ],
      "architectures": [
        "x86_64"
      ],
      "status": "verified",
      "priority": 100,
      "requirements": {
        "minimum_os": null,
        "minimum_runtime": "valle-asr 0.1.0"
      },
      "notes": "The published valle-asr CPU backend validates transcription and word alignment on macOS ARM64, Linux x64 and Windows x64.",
      "options": {
        "segment_seconds": 30
      }
    },
    {
      "id": "native-cpu-linux-arm64",
      "artifact": "safetensors-bf16",
      "backend": "native-cpu",
      "platforms": [
        "linux"
      ],
      "architectures": [
        "aarch64"
      ],
      "status": "unverified",
      "priority": 100,
      "requirements": {
        "minimum_os": null,
        "minimum_runtime": "valle-asr 0.1.0"
      },
      "notes": "CPU backend can compile for this architecture; real inference is not included in the valle-asr validation matrix.",
      "options": {
        "segment_seconds": 30
      }
    },
    {
      "id": "native-cpu-windows-x86_64",
      "artifact": "safetensors-bf16",
      "backend": "native-cpu",
      "platforms": [
        "windows"
      ],
      "architectures": [
        "x86_64"
      ],
      "status": "verified",
      "priority": 100,
      "requirements": {
        "minimum_os": null,
        "minimum_runtime": "valle-asr 0.1.0"
      },
      "notes": "The published valle-asr CPU backend validates transcription and word alignment on macOS ARM64, Linux x64 and Windows x64.",
      "options": {
        "segment_seconds": 30
      }
    },
    {
      "id": "native-cpu-windows-arm64",
      "artifact": "safetensors-bf16",
      "backend": "native-cpu",
      "platforms": [
        "windows"
      ],
      "architectures": [
        "aarch64"
      ],
      "status": "unverified",
      "priority": 100,
      "requirements": {
        "minimum_os": null,
        "minimum_runtime": "valle-asr 0.1.0"
      },
      "notes": "CPU backend can compile for this architecture; real inference is not included in the valle-asr validation matrix.",
      "options": {
        "segment_seconds": 30
      }
    }
  ]
}
